{
  "schema_version": 1,
  "block_id": "utd-fall-midterm-block-06",
  "pillar_id": "utd-fall-midterm",
  "block_title": "Fall Semester Midterm Practice · Matrices & algorithm reasoning",
  "questions": [
    {
      "id": "utd-fall-midterm-251",
      "topic": "Matrix multiplication 1",
      "difficulty": "intermediate",
      "question_type": "single_choice",
      "prompt": "What is entry (1,2) of AB?",
      "context": "Matrices are written as lists of rows. A=[[2, 1], [-1, 3]]; B=[[0, 4], [2, -1]]. Indices start at 1. Products in this workshop are ordinary arithmetic products.",
      "options": [
        "7",
        "9",
        "8",
        "6"
      ],
      "correct_index": 0,
      "hints": [
        "For entry (i,j), take row i from the left matrix and column j from the right matrix.",
        "State the domain and all hypotheses explicitly. Work out the result before comparing the four choices."
      ],
      "explanation": {
        "learning_objective": "Apply row-column multiplication, distinguish AB from BA, and reverse order when transposing a product.",
        "correct_rationale": "Row 1 of A dotted with column 2 of B gives 2·4+1·-1=7.",
        "incorrect_rationales": [
          {
            "option_index": 1,
            "rationale": "9 does not satisfy the stated computation. Row 1 of A dotted with column 2 of B gives 2·4+1·-1=7."
          },
          {
            "option_index": 2,
            "rationale": "8 does not satisfy the stated computation. Row 1 of A dotted with column 2 of B gives 2·4+1·-1=7."
          },
          {
            "option_index": 3,
            "rationale": "6 does not satisfy the stated computation. Row 1 of A dotted with column 2 of B gives 2·4+1·-1=7."
          }
        ]
      },
      "source_notes": [
        "Original slide-aligned practice. Related study: Rosen, uploaded eighth edition, §2.6, odd exercises 3, 11, 13, 17. These are study pointers; this item is not a reproduced textbook exercise."
      ],
      "curriculum": {
        "section": "2.6",
        "odd_exercises": [
          3,
          11,
          13,
          17
        ],
        "workshop": "Matrix multiplication 1"
      },
      "has_exhibit": false,
      "exhibit_url": "",
      "verification": {
        "kind": "midterm",
        "op": "matrix",
        "args": {
          "a": [
            [
              2,
              1
            ],
            [
              -1,
              3
            ]
          ],
          "b": [
            [
              0,
              4
            ],
            [
              2,
              -1
            ]
          ],
          "query": "ab12"
        }
      }
    },
    {
      "id": "utd-fall-midterm-252",
      "topic": "Matrix multiplication 1",
      "difficulty": "intermediate",
      "question_type": "single_choice",
      "prompt": "What is entry (1,2) of BA?",
      "context": "Matrices are written as lists of rows. A=[[2, 1], [-1, 3]]; B=[[0, 4], [2, -1]]. Indices start at 1. Products in this workshop are ordinary arithmetic products.",
      "options": [
        "14",
        "12",
        "13",
        "11"
      ],
      "correct_index": 1,
      "hints": [
        "For entry (i,j), take row i from the left matrix and column j from the right matrix.",
        "State the domain and all hypotheses explicitly. Work out the result before comparing the four choices."
      ],
      "explanation": {
        "learning_objective": "Apply row-column multiplication, distinguish AB from BA, and reverse order when transposing a product.",
        "correct_rationale": "Reverse the roles: 0·1+4·3=12. Matrix multiplication need not commute.",
        "incorrect_rationales": [
          {
            "option_index": 0,
            "rationale": "14 does not satisfy the stated computation. Reverse the roles: 0·1+4·3=12. Matrix multiplication need not commute."
          },
          {
            "option_index": 2,
            "rationale": "13 does not satisfy the stated computation. Reverse the roles: 0·1+4·3=12. Matrix multiplication need not commute."
          },
          {
            "option_index": 3,
            "rationale": "11 does not satisfy the stated computation. Reverse the roles: 0·1+4·3=12. Matrix multiplication need not commute."
          }
        ]
      },
      "source_notes": [
        "Original slide-aligned practice. Related study: Rosen, uploaded eighth edition, §2.6, odd exercises 3, 11, 13, 17. These are study pointers; this item is not a reproduced textbook exercise."
      ],
      "curriculum": {
        "section": "2.6",
        "odd_exercises": [
          3,
          11,
          13,
          17
        ],
        "workshop": "Matrix multiplication 1"
      },
      "has_exhibit": false,
      "exhibit_url": "",
      "verification": {
        "kind": "midterm",
        "op": "matrix",
        "args": {
          "a": [
            [
              2,
              1
            ],
            [
              -1,
              3
            ]
          ],
          "b": [
            [
              0,
              4
            ],
            [
              2,
              -1
            ]
          ],
          "query": "ba12"
        }
      }
    },
    {
      "id": "utd-fall-midterm-253",
      "topic": "Matrix multiplication 1",
      "difficulty": "intermediate",
      "question_type": "single_choice",
      "prompt": "What is the sum of diagonal entries of AB?",
      "context": "Matrices are written as lists of rows. A=[[2, 1], [-1, 3]]; B=[[0, 4], [2, -1]]. Indices start at 1. Products in this workshop are ordinary arithmetic products.",
      "options": [
        "-6",
        "-5",
        "-3",
        "-4"
      ],
      "correct_index": 1,
      "hints": [
        "For entry (i,j), take row i from the left matrix and column j from the right matrix.",
        "State the domain and all hypotheses explicitly. Work out the result before comparing the four choices."
      ],
      "explanation": {
        "learning_objective": "Apply row-column multiplication, distinguish AB from BA, and reverse order when transposing a product.",
        "correct_rationale": "AB=[[2, 7], [6, -7]]; add entries (1,1) and (2,2), obtaining 2+-7.",
        "incorrect_rationales": [
          {
            "option_index": 0,
            "rationale": "-6 does not satisfy the stated computation. AB=[[2, 7], [6, -7]]; add entries (1,1) and (2,2), obtaining 2+-7."
          },
          {
            "option_index": 2,
            "rationale": "-3 does not satisfy the stated computation. AB=[[2, 7], [6, -7]]; add entries (1,1) and (2,2), obtaining 2+-7."
          },
          {
            "option_index": 3,
            "rationale": "-4 does not satisfy the stated computation. AB=[[2, 7], [6, -7]]; add entries (1,1) and (2,2), obtaining 2+-7."
          }
        ]
      },
      "source_notes": [
        "Original slide-aligned practice. Related study: Rosen, uploaded eighth edition, §2.6, odd exercises 3, 11, 13, 17. These are study pointers; this item is not a reproduced textbook exercise."
      ],
      "curriculum": {
        "section": "2.6",
        "odd_exercises": [
          3,
          11,
          13,
          17
        ],
        "workshop": "Matrix multiplication 1"
      },
      "has_exhibit": false,
      "exhibit_url": "",
      "verification": {
        "kind": "midterm",
        "op": "matrix",
        "args": {
          "a": [
            [
              2,
              1
            ],
            [
              -1,
              3
            ]
          ],
          "b": [
            [
              0,
              4
            ],
            [
              2,
              -1
            ]
          ],
          "query": "diagonal"
        }
      }
    },
    {
      "id": "utd-fall-midterm-254",
      "topic": "Matrix multiplication 1",
      "difficulty": "advanced",
      "question_type": "single_choice",
      "prompt": "What is entry (2,1) of A²?",
      "context": "Matrices are written as lists of rows. A=[[2, 1], [-1, 3]]; B=[[0, 4], [2, -1]]. Indices start at 1. Products in this workshop are ordinary arithmetic products.",
      "options": [
        "-4",
        "-5",
        "-3",
        "-6"
      ],
      "correct_index": 1,
      "hints": [
        "For entry (i,j), take row i from the left matrix and column j from the right matrix.",
        "State the domain and all hypotheses explicitly. Work out the result before comparing the four choices."
      ],
      "explanation": {
        "learning_objective": "Apply row-column multiplication, distinguish AB from BA, and reverse order when transposing a product.",
        "correct_rationale": "A² means AA, not entrywise squaring. Entry (2,1) is -1·2+3·-1=-5.",
        "incorrect_rationales": [
          {
            "option_index": 0,
            "rationale": "-4 does not satisfy the stated computation. A² means AA, not entrywise squaring. Entry (2,1) is -1·2+3·-1=-5."
          },
          {
            "option_index": 2,
            "rationale": "-3 does not satisfy the stated computation. A² means AA, not entrywise squaring. Entry (2,1) is -1·2+3·-1=-5."
          },
          {
            "option_index": 3,
            "rationale": "-6 does not satisfy the stated computation. A² means AA, not entrywise squaring. Entry (2,1) is -1·2+3·-1=-5."
          }
        ]
      },
      "source_notes": [
        "Original slide-aligned practice. Related study: Rosen, uploaded eighth edition, §2.6, odd exercises 3, 11, 13, 17. These are study pointers; this item is not a reproduced textbook exercise."
      ],
      "curriculum": {
        "section": "2.6",
        "odd_exercises": [
          3,
          11,
          13,
          17
        ],
        "workshop": "Matrix multiplication 1"
      },
      "has_exhibit": false,
      "exhibit_url": "",
      "verification": {
        "kind": "midterm",